{
  "$schema": "http://json-schema.org/draft-07/schema#",
  "title": "Enrich: compatibility warnings",
  "description": "Known packaging-format compatibility issues for one specific app on one specific source (e.g. GNOME Boxes via Snap losing KVM/libvirt device access to confinement) — surfaced in app's install drawer next to the affected source, not a separate page.",
  "type": "array",
  "items": {
    "type": "object",
    "required": ["source", "name", "severity", "issue", "reason"],
    "additionalProperties": false,
    "properties": {
      "source": { "type": "string", "description": "A PackageSourceId, e.g. \"snap-snapcraft\"." },
      "name": { "type": "string", "description": "The exact SourcedPackage.name on that source." },
      "severity": {
        "type": "string",
        "enum": ["warning", "info"],
        "description": "\"warning\" for a real functional problem, \"info\" for a lesser one with a confirmed one-line fix."
      },
      "issue": { "type": "string", "description": "What actually goes wrong, in plain terms." },
      "fix": {
        "type": "string",
        "description": "A concrete workaround, when one exists — omit entirely rather than leaving empty when there's no known fix."
      },
      "reason": {
        "type": "string",
        "description": "How this was verified (issue trackers, forum reports, ...) — required so the warning is auditable later, not just an unexplained line."
      }
    }
  }
}
